{
  "$schema": "http://json-schema.org/draft-07/schema#",
  "type": "object",
  "properties": {
    "$schema": {
      "type": "string",
      "const": "https://json-schema.org/draft/2020-12/schema"
    },
    "$id": {
      "type": "string"
    },
    "type": {
      "type": "string",
      "const": "object"
    },
    "properties": {
      "type": "object",
      "propertyNames": {
        "type": "string"
      },
      "additionalProperties": {}
    },
    "required": {
      "type": "array",
      "items": {
        "type": "string"
      }
    },
    "additionalProperties": {
      "anyOf": [
        {
          "type": "boolean"
        },
        {
          "type": "object",
          "propertyNames": {
            "type": "string"
          },
          "additionalProperties": {}
        }
      ]
    }
  },
  "required": [
    "type"
  ],
  "additionalProperties": {},
  "$comment": "Generated from schema.ts by scripts/generate-native-card-schemas.ts."
}
