{
  "type": "object",
  "additionalProperties": false,
  "required": ["file", "pointer", "check", "category", "message", "action"],
  "properties": {
    "file": {
      "type": "string",
      "minLength": 1
    },
    "pointer": {
      "type": "string"
    },
    "check": {
      "type": "string",
      "minLength": 1
    },
    "category": {
      "enum": [
        "input",
        "configuration",
        "tool",
        "conversion",
        "api_gap",
        "validation",
        "formal"
      ]
    },
    "message": {
      "type": "string",
      "minLength": 1
    },
    "action": {
      "type": "string",
      "minLength": 1
    }
  }
}
